{
  "id": "safeclaw-high-risk",
  "version": "v1",
  "name": "SafeClaw High Risk Approval",
  "defaultEffect": "deny",
  "rules": [
    {
      "id": "allow-safe-readonly",
      "effect": "allow",
      "description": "Allow read-only operations",
      "condition": {
        "any": [
          { "field": "action.type", "operator": "startsWith", "value": "safe.read" }
        ]
      }
    },
    {
      "id": "require-approval-all-risky",
      "effect": "require_approval",
      "description": "Require approval for any non-read action",
      "condition": {
        "any": [
          { "field": "action.type", "operator": "startsWith", "value": "filesystem." },
          { "field": "action.type", "operator": "startsWith", "value": "code." },
          { "field": "action.type", "operator": "startsWith", "value": "network." },
          { "field": "action.type", "operator": "startsWith", "value": "secrets." },
          { "field": "action.type", "operator": "startsWith", "value": "payments." },
          { "field": "action.type", "operator": "startsWith", "value": "mcp." },
          { "field": "action.type", "operator": "startsWith", "value": "agent." }
        ]
      }
    }
  ]
}
